{
  "schema_version": "1.0",
  "evidence_id": "EVD-LULU-A5-001",
  "template_id": "TPL-LULU-A5-INTERIOR",
  "status": "candidate",
  "original": {
    "provider": "Lulu",
    "source_url": "https://assets.lulu.com/media/templates/book/lulu-book-template-all-a5.zip",
    "relative_path": "research/reference-originals/lulu-book-template-all-a5.zip",
    "sha256": "B604553285B3C811350F34D499377D63E74B9ACFBBD7524FFA4D5871F304A243",
    "format": "zip-with-indd-idml"
  },
  "chinese_book_references": [],
  "adobe_sources": [],
  "print_sources": [],
  "field_mapping_path": null,
  "activation_errors": [
    "requires two Chinese published-book references",
    "requires one Adobe source",
    "requires one print or trim source",
    "requires reviewed field mapping"
  ]
}
